tweet_id,in_reply_to_status_id,in_reply_to_user_id,timestamp,text,retweeted_status_id,retweeted_status_user_id,retweeted_status_timestamp,expanded_urls,rating_numerator,rating_denominator,name,stages,Language,Like_Count,Retweet_count,Most_Likely_Prediction-p1,p1_conf
687807801670897665,,,"DatetimeIndex(['2016-01-15 01:25:33'], dtype='datetime64[ns]', freq=None)",Meet Trooper &amp; Maya. Trooper protects Maya from bad things like dognappers and Comcast. So touching. 11/10 for both https://t.co/c98k1IoZKy,,,,https://twitter.com/dog_rates/status/687807801670897665/photo/1,11.0,10,Trooper,NA,en,2581,776,Staffordshire_bullterrier,0.151113
687664829264453632,,,"DatetimeIndex(['2016-01-14 15:57:26'], dtype='datetime64[ns]', freq=None)",Meet Opal. He's a Belgian Dijon Poofster. Upset because his hood makes him look like blond Justin Timberlake. 11/10 https://t.co/IAt3jRZ5ez,,,,https://twitter.com/dog_rates/status/687664829264453632/photo/1,11.0,10,Opal,NA,en,2087,570,Pug,0.957365
687494652870668288,,,"DatetimeIndex(['2016-01-14 04:41:12'], dtype='datetime64[ns]', freq=None)",This is Marq. He stole this car. 7/10 wtf Marq? https://t.co/MHScqo5l8c,,,,https://twitter.com/dog_rates/status/687494652870668288/photo/1,7.0,10,Marq,NA,en,2065,641,Rottweiler,0.391471
687460506001633280,,,"DatetimeIndex(['2016-01-14 02:25:31'], dtype='datetime64[ns]', freq=None)",This is Kramer. He's a Picasso Tortellini. Tie couldn't be more accurate. Confident af. Runs his own business. 10/10 https://t.co/jIcVW0xxmH,,,,https://twitter.com/dog_rates/status/687460506001633280/photo/1,10.0,10,Kramer,NA,en,2199,600,Boston_bull,0.223366
687317306314240000,,,"DatetimeIndex(['2016-01-13 16:56:30'], dtype='datetime64[ns]', freq=None)",This is Tyrone. He's a leaf wizard. Self-motivated. No eyes (tragic). Inspirational af. 11/10 enthusiasm is tangible https://t.co/pRp1Npucbz,,,,"https://twitter.com/dog_rates/status/687317306314240000/photo/1,https://twitter.com/dog_rates/status/687317306314240000/photo/1",11.0,10,Tyrone,NA,en,21692,10159,Shih-tzu,0.747208
687127927494963200,,,"DatetimeIndex(['2016-01-13 04:23:58'], dtype='datetime64[ns]', freq=None)",Meet Gordon. He's an asshole. 9/10 would still pet https://t.co/a34N7QwKbb,,,,https://twitter.com/dog_rates/status/687127927494963200/photo/1,9.0,10,Gordon,NA,en,5901,2532,Pug,0.178205
687124485711986689,,,"DatetimeIndex(['2016-01-13 04:10:18'], dtype='datetime64[ns]', freq=None)",Say hello to Samson. He's a Firecracker Hagen-Dazs. 11/10 objects in mirror may be more petable than they appear https://t.co/03vR9dn7jy,,,,https://twitter.com/dog_rates/status/687124485711986689/photo/1,11.0,10,Samson,NA,en,2332,560,Car_mirror,0.997121
687109925361856513,,,"DatetimeIndex(['2016-01-13 03:12:26'], dtype='datetime64[ns]', freq=None)",This is Baxter. He looks like a fun dog. Prefers action shots. 11/10 the last one is impeccable https://t.co/LHcH1yhhIb,,,,"https://twitter.com/dog_rates/status/687109925361856513/photo/1,https://twitter.com/dog_rates/status/687109925361856513/photo/1,https://twitter.com/dog_rates/status/687109925361856513/photo/1",11.0,10,Baxter,NA,en,6258,2744,Borzoi,0.883086
686947101016735744,,,"DatetimeIndex(['2016-01-12 16:25:26'], dtype='datetime64[ns]', freq=None)",This is Jackson. He was specifically told not to sleep in the fridge. Damn it Jackson. 11/10 would squeeze softly https://t.co/lJs10ZJsgj,,,,https://twitter.com/dog_rates/status/686947101016735744/photo/1,11.0,10,Jackson,NA,en,9274,3514,Refrigerator,0.799795
686606069955735556,,,"DatetimeIndex(['2016-01-11 17:50:18'], dtype='datetime64[ns]', freq=None)","Meet Horace. He was practicing his levitation, minding his own business when a rogue tennis ball spooked him. 10/10 https://t.co/tB9xYjMyZd",,,,https://twitter.com/dog_rates/status/686606069955735556/photo/1,10.0,10,Horace,NA,en,2030,599,Labrador_retriever,0.320012
686386521809772549,,,"DatetimeIndex(['2016-01-11 03:17:53'], dtype='datetime64[ns]', freq=None)",Say hello to Crimson. He's a Speckled Winnebago. Main passions are air hockey &amp; parkour. 11/10 would pet thoroughly https://t.co/J5aI7SjzDc,,,,https://twitter.com/dog_rates/status/686386521809772549/photo/1,11.0,10,Crimson,NA,en,3497,981,Yorkshire_terrier,0.477704
686050296934563840,,,"DatetimeIndex(['2016-01-10 05:01:51'], dtype='datetime64[ns]', freq=None)",This is Flvio. He's a Macedonian Poppycock. 97% floof. Jubilant af. 11/10 personally I'd pet the hell out of https://t.co/BUyX7isHRg,,,,https://twitter.com/dog_rates/status/686050296934563840/photo/1,11.0,10,Flvio,NA,en,2377,817,Pomeranian,0.985789
686003207160610816,,,"DatetimeIndex(['2016-01-10 01:54:44'], dtype='datetime64[ns]', freq=None)",This is Hammond. He's a peculiar pup. Loves long walks. Bark barely audible. Too many legs. 3/10 must be rare https://t.co/NOIiRWr5Jf,,,,https://twitter.com/dog_rates/status/686003207160610816/photo/1,3.0,10,Hammond,NA,en,1961,710,Damselfly,0.190786
685973236358713344,,,"DatetimeIndex(['2016-01-09 23:55:38'], dtype='datetime64[ns]', freq=None)",This is Lorelei. She's contemplating her existence and the eventual heat death of the universe. 11/10 very majestic https://t.co/xbUoULOIS8,,,,https://twitter.com/dog_rates/status/685973236358713344/photo/1,11.0,10,Lorelei,NA,en,2278,594,Siberian_husky,0.450678
685906723014619143,,,"DatetimeIndex(['2016-01-09 19:31:20'], dtype='datetime64[ns]', freq=None)",This is Olive. He's stuck in a sleeve. 9/10 damn it Olive https://t.co/NnLjg6BgyF,,,,"https://twitter.com/dog_rates/status/685906723014619143/photo/1,https://twitter.com/dog_rates/status/685906723014619143/photo/1",9.0,10,Olive,NA,en,8118,3227,Yorkshire_terrier,0.414963
685663452032069632,,,"DatetimeIndex(['2016-01-09 03:24:40'], dtype='datetime64[ns]', freq=None)","Meet Brooks. He's confused by the almighty ball of tennis. 12/10 

(vid by @PDolan37) https://t.co/AcVWe39nmM",,,,https://twitter.com/dog_rates/status/685663452032069632/video/1,12.0,10,Brooks,NA,en,3494,1621,Chesapeake_bay_retriever,0.171174
685321586178670592,,,"DatetimeIndex(['2016-01-08 04:46:13'], dtype='datetime64[ns]', freq=None)",This is Rocky. He sleeps like a psychopath. 10/10 quality tongue slip https://t.co/MbgG95mUdu,,,,https://twitter.com/dog_rates/status/685321586178670592/photo/1,10.0,10,Rocky,NA,en,2861,718,Boston_bull,0.972483
685198997565345792,,,"DatetimeIndex(['2016-01-07 20:39:06'], dtype='datetime64[ns]', freq=None)",This is Alfie. That is his time machine. He's very proud of it. Without him life as we know it would not exist 11/10 https://t.co/530Yfbl5xo,,,,https://twitter.com/dog_rates/status/685198997565345792/photo/1,11.0,10,Alfie,NA,en,2503,740,Dishwasher,0.8888290000000001
684959798585110529,,,"DatetimeIndex(['2016-01-07 04:48:36'], dtype='datetime64[ns]', freq=None)",This is Jerry. He's a neat dog. No legs (tragic). Has more horns than a dog usually does. Bark is unique af. 5/10 https://t.co/85q7xlplsJ,,,,https://twitter.com/dog_rates/status/684959798585110529/photo/1,5.0,10,Jerry,NA,en,7171,3465,Llama,0.379624
684940049151070208,,,"DatetimeIndex(['2016-01-07 03:30:07'], dtype='datetime64[ns]', freq=None)",This is Oreo. She's a photographer and a model. Living a double pupple life. 12/10 such talent much cute would pet https://t.co/zNeLxJeAoL,,,,"https://twitter.com/dog_rates/status/684940049151070208/photo/1,https://twitter.com/dog_rates/status/684940049151070208/photo/1",12.0,10,Oreo,NA,en,3460,1162,Border_collie,0.665578
684926975086034944,,,"DatetimeIndex(['2016-01-07 02:38:10'], dtype='datetime64[ns]', freq=None)",Meet Bruiser &amp; Charlie. They are the best of pals. Been through it all together. Both 11/10. 1 like=1 friendship https://t.co/PEXHuvSVD4,,,,https://twitter.com/dog_rates/status/684926975086034944/photo/1,11.0,10,Bruiser,NA,en,3782,531,Labrador_retriever,0.769412
684902183876321280,,,"DatetimeIndex(['2016-01-07 00:59:40'], dtype='datetime64[ns]', freq=None)",This is Perry. He's an Augustus Gloopster. Very condescending. Makes up for it with the sneaky tongue slip. 11/10 https://t.co/JVvIrUmTkR,,,,https://twitter.com/dog_rates/status/684902183876321280/photo/1,11.0,10,Perry,NA,en,2018,593,Pembroke,0.708034
684800227459624960,,,"DatetimeIndex(['2016-01-06 18:14:31'], dtype='datetime64[ns]', freq=None)",Meet Theodore. He's dapper as hell. Probably owns horses. Uses 'summer' as a verb. Often quotes philosophers. 11/10 https://t.co/J3Ld4fRbSy,,,,https://twitter.com/dog_rates/status/684800227459624960/photo/1,11.0,10,Theodore,NA,en,2924,1096,Miniature_schnauzer,0.294457
684567543613382656,,,"DatetimeIndex(['2016-01-06 02:49:55'], dtype='datetime64[ns]', freq=None)",This is Bobby. He doesn't give a damn about personal space. Convinced he called shotgun first. 4/10 not the best dog https://t.co/b8XW69gSaU,,,,https://twitter.com/dog_rates/status/684567543613382656/photo/1,4.0,10,Bobby,NA,en,3248,1378,Minibus,0.401942
684481074559381504,,,"DatetimeIndex(['2016-01-05 21:06:19'], dtype='datetime64[ns]', freq=None)",Meet Pippa. She's an Elfin High Feta. Compact af. Easy to transport. Great for vacations. 10/10 would keep in pocket https://t.co/nBtDeZ4yAb,,,,https://twitter.com/dog_rates/status/684481074559381504/photo/1,10.0,10,Pippa,NA,en,4168,1297,Chihuahua,0.93781
684460069371654144,,,"DatetimeIndex(['2016-01-05 19:42:51'], dtype='datetime64[ns]', freq=None)",This is Jeph. He's a Western Sagittarius Dookmarriot. Frightened by leaf. Caught him off guard. 10/10 calm down Jeph https://t.co/bicyOV6lju,,,,https://twitter.com/dog_rates/status/684460069371654144/photo/1,10.0,10,Jeph,NA,en,2126,616,Labrador_retriever,0.673691
684241637099323392,,,"DatetimeIndex(['2016-01-05 05:14:53'], dtype='datetime64[ns]', freq=None)",This is Obi. He got camera shy. 12/10 https://t.co/feiPiq7z94,,,,"https://twitter.com/dog_rates/status/684241637099323392/photo/1,https://twitter.com/dog_rates/status/684241637099323392/photo/1,https://twitter.com/dog_rates/status/684241637099323392/photo/1",12.0,10,Obi,NA,en,8819,3653,Pembroke,0.508498
684195085588783105,,,"DatetimeIndex(['2016-01-05 02:09:54'], dtype='datetime64[ns]', freq=None)",This is Tino. He really likes corndogs. 9/10 https://t.co/cUxGtnBfc2,,,,https://twitter.com/dog_rates/status/684195085588783105/photo/1,9.0,10,Tino,NA,en,2062,577,Chihuahua,0.379365
684177701129875456,,,"DatetimeIndex(['2016-01-05 01:00:50'], dtype='datetime64[ns]', freq=None)",This is Kulet. She's very proud of the flower she picked. Loves it dearly. 10/10 now I want a flower https://t.co/myUUwqJIs7,,,,https://twitter.com/dog_rates/status/684177701129875456/photo/1,10.0,10,Kulet,NA,en,2179,747,Chow,0.334783
684097758874210310,,,"DatetimeIndex(['2016-01-04 19:43:10'], dtype='datetime64[ns]', freq=None)",Say hello to Lupe. This is how she sleeps. 10/10 impressive really https://t.co/Fz6iZWlk8C,,,,https://twitter.com/dog_rates/status/684097758874210310/photo/1,10.0,10,Lupe,NA,en,4430,1590,Labrador_retriever,0.6278560000000001
683857920510050305,,,"DatetimeIndex(['2016-01-04 03:50:08'], dtype='datetime64[ns]', freq=None)",Meet Sadie. She fell asleep on the beach and her friends buried her. 10/10 can't trust fellow puppers these days https://t.co/LoKVvc1xAW,,,,https://twitter.com/dog_rates/status/683857920510050305/photo/1,10.0,10,Sadie,NA,en,4093,1233,Bluetick,0.174738
683852578183077888,,,"DatetimeIndex(['2016-01-04 03:28:54'], dtype='datetime64[ns]', freq=None)","Say hello to Tiger. He's a penbroke (little dog pun for ya, no need to applaud I know it was good) 10/10 good dog https://t.co/Yei0HzS3JN",,,,https://twitter.com/dog_rates/status/683852578183077888/photo/1,10.0,10,Tiger,NA,en,2073,390,Toy_poodle,0.5513520000000001
683849932751646720,,,"DatetimeIndex(['2016-01-04 03:18:23'], dtype='datetime64[ns]', freq=None)",This is Jiminy. He's not the brightest dog. Needs to lay off the kibble. 5/10 still petable https://t.co/omln4LOy1x,,,,https://twitter.com/dog_rates/status/683849932751646720/photo/1,5.0,10,Jiminy,NA,en,2824,1089,Hog,0.458855
683773439333797890,,,"DatetimeIndex(['2016-01-03 22:14:26'], dtype='datetime64[ns]', freq=None)",This is Buddy. He's gaining strength. Currently an F4 tornado with wind speeds up to 260mph. Very devastating. 9/10 https://t.co/qipZbshNsR,,,,https://twitter.com/dog_rates/status/683773439333797890/photo/1,9.0,10,Buddy,NA,en,3610,1500,Miniature_pinscher,0.0728852
683742671509258241,,,"DatetimeIndex(['2016-01-03 20:12:10'], dtype='datetime64[ns]', freq=None)",Meet Sebastian. He's a womanizer. Romantic af. Always covered in flower petals. Also a poet. 11/10 dreamy as hell https://t.co/eoL1bCpWCg,,,,https://twitter.com/dog_rates/status/683742671509258241/photo/1,11.0,10,Sebastian,NA,en,7033,3699,Pembroke,0.895279
683498322573824003,,,"DatetimeIndex(['2016-01-03 04:01:13'], dtype='datetime64[ns]', freq=None)",This is Griffin. He's desperate for both a physical and emotion connection. 11/10 I'd hug the hell out of Griffin https://t.co/ObWcOEekt0,,,,https://twitter.com/dog_rates/status/683498322573824003/photo/1,11.0,10,Griffin,NA,en,3407,1065,Airedale,0.945362
683391852557561860,,,"DatetimeIndex(['2016-01-02 20:58:09'], dtype='datetime64[ns]', freq=None)","Say hello to Jack (pronounced ""Kevin""). He's a Virgo Episcopalian. Can summon rainbows. 11/10 magical as hell https://t.co/YHXrdUTHd6",,,,https://twitter.com/dog_rates/status/683391852557561860/photo/1,11.0,10,Jack,NA,en,8197,2639,French_bulldog,0.992833
683030066213818368,,,"DatetimeIndex(['2016-01-01 21:00:32'], dtype='datetime64[ns]', freq=None)",This is Lulu. She's contemplating all her unreached 2015 goals and daydreaming of a more efficient tomorrow. 10/10 https://t.co/h3ScYuz77J,,,,https://twitter.com/dog_rates/status/683030066213818368/photo/1,10.0,10,Lulu,NA,en,2324,810,Boxer,0.722218
682962037429899265,,,"DatetimeIndex(['2016-01-01 16:30:13'], dtype='datetime64[ns]', freq=None)",This is Darrel. He just robbed a 7/11 and is in a high speed police chase. Was just spotted by the helicopter 10/10 https://t.co/7EsP8LmSp5,,,,https://twitter.com/dog_rates/status/682962037429899265/photo/1,7.0,11,Darrel,NA,en,39976,18566,Dingo,0.2786
682750546109968385,,,"DatetimeIndex(['2016-01-01 02:29:49'], dtype='datetime64[ns]', freq=None)",Meet Taco. He's a speckled Garnier Fructis. Loves to shadow box. Ears out of control. Friend clearly impressed 9/10 https://t.co/85X1GHohFr,,,,https://twitter.com/dog_rates/status/682750546109968385/photo/1,9.0,10,Taco,NA,en,1635,482,English_setter,0.947198
682662431982772225,,,"DatetimeIndex(['2015-12-31 20:39:41'], dtype='datetime64[ns]', freq=None)",Meet Joey and Izzy. Joey only has one ear that works and Izzy wants 2015 to be over already. Both great pups. 11/10s https://t.co/WgQTIQ93BB,,,,https://twitter.com/dog_rates/status/682662431982772225/photo/1,11.0,10,Joey,NA,en,3280,1185,Beagle,0.413824
682393905736888321,,,"DatetimeIndex(['2015-12-31 02:52:40'], dtype='datetime64[ns]', freq=None)",This is Kreg. He's riding an invisible jet ski. 11/10 that's downright legendary https://t.co/BA5AV5dx6Y,,,,https://twitter.com/dog_rates/status/682393905736888321/photo/1,11.0,10,Kreg,NA,en,2392,755,Vizsla,0.657275
682389078323662849,,,"DatetimeIndex(['2015-12-31 02:33:29'], dtype='datetime64[ns]', freq=None)","Meet Brody. He's a Downton Abbey Falsetto. Addicted to grating cheese. He says he can stop but we know he can't
9/10 https://t.co/vBeiQq6SaZ",,,,https://twitter.com/dog_rates/status/682389078323662849/photo/1,9.0,10,Brody,NA,en,1792,513,Curly-coated_retriever,0.482288
682303737705140231,,,"DatetimeIndex(['2015-12-30 20:54:22'], dtype='datetime64[ns]', freq=None)",This is Todo. He's screaming because he doesn't want to wear his sweater or a seat belt. 9/10 gotta buckle up pup https://t.co/Nm8Spw4HbD,,,,https://twitter.com/dog_rates/status/682303737705140231/photo/1,9.0,10,Todo,NA,en,3316,1107,Seat_belt,0.997659
682259524040966145,,,"DatetimeIndex(['2015-12-30 17:58:40'], dtype='datetime64[ns]', freq=None)",Meet Jax. He's an Iglesias Hufflepoof. Quite the jokester. Takes it too far sometimes. Can be very hurtful. 9/10 https://t.co/i5TeG0KYcW,,,,https://twitter.com/dog_rates/status/682259524040966145/photo/1,9.0,10,Jax,NA,en,4487,1355,Siberian_husky,0.43967
682242692827447297,,,"DatetimeIndex(['2015-12-30 16:51:48'], dtype='datetime64[ns]', freq=None)",This is Samson. He patrols his waters on the back of his massive shielded battle dog. 11/10 https://t.co/f8dVgDYDFf,,,,https://twitter.com/dog_rates/status/682242692827447297/photo/1,11.0,10,Samson,NA,en,3495,1311,Snorkel,0.504983
682059653698686977,,,"DatetimeIndex(['2015-12-30 04:44:28'], dtype='datetime64[ns]', freq=None)",This is Tess. Her main passions are shelves and baking too many cookies. 11/10 https://t.co/IriJlVZ6m4,,,,"https://twitter.com/dog_rates/status/682059653698686977/photo/1,https://twitter.com/dog_rates/status/682059653698686977/photo/1",11.0,10,Tess,NA,en,5348,1881,Jigsaw_puzzle,0.995873
682032003584274432,,,"DatetimeIndex(['2015-12-30 02:54:35'], dtype='datetime64[ns]', freq=None)",This is Ulysses. He likes holding hands and his eyes are magic. 11/10 https://t.co/gPmJHmtgak,,,,https://twitter.com/dog_rates/status/682032003584274432/photo/1,11.0,10,Ulysses,NA,en,7084,2238,Schipperke,0.997953
681981167097122816,,,"DatetimeIndex(['2015-12-29 23:32:35'], dtype='datetime64[ns]', freq=None)",This is Jimothy. He's a Trinidad Poliwhirl. Father was a velociraptor. Exceptionally unamused. 12/10 would adopt https://t.co/VwdIk0OwVx,,,,https://twitter.com/dog_rates/status/681981167097122816/photo/1,12.0,10,Jimothy,NA,en,2979,1136,Labrador_retriever,0.4525770000000001
681579835668455424,,,"DatetimeIndex(['2015-12-28 20:57:50'], dtype='datetime64[ns]', freq=None)",This is Apollo. He thought you weren't coming back so he had a mental breakdown. 8/10 we've all been there https://t.co/ojUBrDCHLT,,,,https://twitter.com/dog_rates/status/681579835668455424/photo/1,8.0,10,Apollo,NA,en,3817,1453,Rottweiler,0.760671
681523177663676416,,,"DatetimeIndex(['2015-12-28 17:12:42'], dtype='datetime64[ns]', freq=None)",This is Carly. She's actually 2 dogs fused together. Very innovative. Probably has superpowers. 12/10 for double dog https://t.co/GQn2IopLud,,,,https://twitter.com/dog_rates/status/681523177663676416/photo/1,12.0,10,Carly,NA,en,15452,6468,Norfolk_terrier,0.205067
681339448655802368,,,"DatetimeIndex(['2015-12-28 05:02:37'], dtype='datetime64[ns]', freq=None)",This is Asher. He's not wearing a seatbelt or keeping both paws on the wheel. Absolute menace on the roadways. 9/10 https://t.co/V3SWuHACkh,,,,https://twitter.com/dog_rates/status/681339448655802368/photo/1,9.0,10,Asher,NA,en,10008,4505,Seat_belt,0.5324409999999999
681320187870711809,,,"DatetimeIndex(['2015-12-28 03:46:05'], dtype='datetime64[ns]', freq=None)",This is Glacier. He's a very happy pup. Loves to sing in the sunlight. 11/10 https://t.co/jTBPqKgkz7,,,,https://twitter.com/dog_rates/status/681320187870711809/photo/1,11.0,10,Glacier,NA,en,2870,846,Samoyed,0.362596
681302363064414209,,,"DatetimeIndex(['2015-12-28 02:35:15'], dtype='datetime64[ns]', freq=None)",This is Chuck. He's a neat dog. Very flexible. Trapped in a glass case of emotion. Devastatingly unfluffy 3/10 https://t.co/YqbU9xHV3p,,,,https://twitter.com/dog_rates/status/681302363064414209/photo/1,3.0,10,Chuck,NA,en,4257,2031,Frilled_lizard,0.326259
681281657291280384,,,"DatetimeIndex(['2015-12-28 01:12:59'], dtype='datetime64[ns]', freq=None)",Meet Sarge. His parents signed him up for dancing lessons but his true passion is roller coasters 11/10 very petable https://t.co/KvVoBIgkje,,,,https://twitter.com/dog_rates/status/681281657291280384/photo/1,11.0,10,Sarge,NA,en,3460,1225,Saint_bernard,0.99883
681261549936340994,,,"DatetimeIndex(['2015-12-27 23:53:05'], dtype='datetime64[ns]', freq=None)",Say hello to Panda. He's a Quackadilly Shooster. Not amused by your fake ball throwing motion. 9/10 would hug lots https://t.co/wL1iDvbcVk,,,,https://twitter.com/dog_rates/status/681261549936340994/photo/1,9.0,10,Panda,NA,en,1562,301,Tibetan_terrier,0.382101
681242418453299201,,,"DatetimeIndex(['2015-12-27 22:37:04'], dtype='datetime64[ns]', freq=None)",This is Champ. He's being sacrificed to the Aztec sun god Huitzilopochtli. So sad. 10/10 Champ doesn't deserve this https://t.co/VGsziXImoy,,,,https://twitter.com/dog_rates/status/681242418453299201/photo/1,10.0,10,Champ,NA,en,1610,607,Motor_scooter,0.255934
681193455364796417,,,"DatetimeIndex(['2015-12-27 19:22:30'], dtype='datetime64[ns]', freq=None)",This is Aspen. He's astronomically fluffy. I wouldn't stop petting this dog if the world was ending around me 11/10 https://t.co/oBlgL9nxpx,,,,"https://twitter.com/dog_rates/status/681193455364796417/photo/1,https://twitter.com/dog_rates/status/681193455364796417/photo/1",11.0,10,Aspen,NA,en,3994,1650,Pomeranian,0.992619
680959110691590145,,,"DatetimeIndex(['2015-12-27 03:51:18'], dtype='datetime64[ns]', freq=None)",This is Ozzie. He was doing fine until he lost traction in those festive socks. Now he's tired. 9/10 still killin it https://t.co/u4FYdIRKnY,,,,"https://twitter.com/dog_rates/status/680959110691590145/photo/1,https://twitter.com/dog_rates/status/680959110691590145/photo/1,https://twitter.com/dog_rates/status/680959110691590145/photo/1",9.0,10,Ozzie,NA,en,4903,2202,Carousel,0.500992
680940246314430465,,,"DatetimeIndex(['2015-12-27 02:36:20'], dtype='datetime64[ns]', freq=None)",This is Alice. She's an idiot. 4/10 https://t.co/VQXdwJfkyS,,,,https://twitter.com/dog_rates/status/680940246314430465/photo/1,4.0,10,Alice,NA,en,3471,1179,Soft-coated_wheaten_terrier,0.289598
680934982542561280,,,"DatetimeIndex(['2015-12-27 02:15:25'], dtype='datetime64[ns]', freq=None)",Say hello to Sadie. She's a Tortellini Sidewinder. Very jubilant pup. Seems loyal. Leaves on point. 10/10 petable af https://t.co/g2bTu4ayPl,,,,https://twitter.com/dog_rates/status/680934982542561280/photo/1,10.0,10,Sadie,NA,en,2235,487,Labrador_retriever,0.7843979999999999
680913438424612864,,,"DatetimeIndex(['2015-12-27 00:49:49'], dtype='datetime64[ns]', freq=None)",Meet Griswold. He's dapper as hell. Already pumped for next Christmas. 11/10 https://t.co/5NrpNDyFzN,,,,https://twitter.com/dog_rates/status/680913438424612864/photo/1,11.0,10,Griswold,NA,en,2567,690,Pomeranian,0.615678
680889648562991104,,,"DatetimeIndex(['2015-12-26 23:15:17'], dtype='datetime64[ns]', freq=None)",This is Cheesy. It's her birthday. She's patiently waiting to eat her party muffin. 9/10 happy birthday pup https://t.co/cH2H7mch2H,,,,https://twitter.com/dog_rates/status/680889648562991104/photo/1,9.0,10,Cheesy,NA,en,1899,409,Shetland_sheepdog,0.876337
680798457301471234,,,"DatetimeIndex(['2015-12-26 17:12:55'], dtype='datetime64[ns]', freq=None)",Say hello to Moofasa. He must be a powerful dog. Fenced in for your protection. Just got his ear pierced. 6/10 https://t.co/w6fRfQ3RXD,,,,https://twitter.com/dog_rates/status/680798457301471234/photo/1,6.0,10,Moofasa,NA,en,3073,1158,Ram,0.499761
680609293079592961,,,"DatetimeIndex(['2015-12-26 04:41:15'], dtype='datetime64[ns]', freq=None)",This is Brody. That is his chair. He loves his chair. Never leaves it. 9/10 might be stuck actually https://t.co/WvJRg0XJit,,,,https://twitter.com/dog_rates/status/680609293079592961/photo/1,9.0,10,Brody,NA,en,2836,793,French_bulldog,0.700764
680583894916304897,,,"DatetimeIndex(['2015-12-26 03:00:19'], dtype='datetime64[ns]', freq=None)",This is Penny. Her tennis ball slowly rolled down her cone and into the pool. 8/10 bad things happen to good puppers https://t.co/YNWU7LeFgg,,,,"https://twitter.com/dog_rates/status/680583894916304897/photo/1,https://twitter.com/dog_rates/status/680583894916304897/photo/1,https://twitter.com/dog_rates/status/680583894916304897/photo/1,https://twitter.com/dog_rates/status/680583894916304897/photo/1",8.0,10,Penny,NA,en,3881,1482,Tub,0.8898010000000001
680497766108381184,,,"DatetimeIndex(['2015-12-25 21:18:05'], dtype='datetime64[ns]', freq=None)",Meet Percy. He's a Latvian Yuletide Heineken. Refuses to take off sweater. Kinda feisty. 12/10 would keep in pocket https://t.co/QGM5Fcuv7s,,,,https://twitter.com/dog_rates/status/680497766108381184/photo/1,12.0,10,Percy,NA,en,4562,2124,Chihuahua,0.538354
680221482581123072,,,"DatetimeIndex(['2015-12-25 03:00:14'], dtype='datetime64[ns]', freq=None)",This is CeCe. She's patiently waiting for Santa. 10/10 https://t.co/ZJUypFFwvg,,,,https://twitter.com/dog_rates/status/680221482581123072/photo/1,10.0,10,CeCe,NA,en,1566,323,Bubble,0.240173
680206703334408192,,,"DatetimeIndex(['2015-12-25 02:01:30'], dtype='datetime64[ns]', freq=None)",I hope everyone enjoys this picture as much as I do. This is Toby. 12/10 https://t.co/vHnu1g9EJm,,,,https://twitter.com/dog_rates/status/680206703334408192/photo/1,12.0,10,Toby,NA,en,3045,1299,Christmas_stocking,0.149758
680161097740095489,,,"DatetimeIndex(['2015-12-24 23:00:17'], dtype='datetime64[ns]', freq=None)",Meet Goliath. He's an example of irony. Head is phenomenally round. Wants to be an ornament. 12/10 would hug gently https://t.co/72Dil0Aktw,,,,https://twitter.com/dog_rates/status/680161097740095489/photo/1,12.0,10,Goliath,NA,en,2485,811,Bluetick,0.268681
680130881361686529,,,"DatetimeIndex(['2015-12-24 21:00:12'], dtype='datetime64[ns]', freq=None)",This is Reggie. His Santa hat is a little big. 10/10 he's still having fun https://t.co/w0dcGXq7qK,,,,https://twitter.com/dog_rates/status/680130881361686529/photo/1,10.0,10,Reggie,NA,en,2466,1054,Maltese_dog,0.199121
680115823365742593,,,"DatetimeIndex(['2015-12-24 20:00:22'], dtype='datetime64[ns]', freq=None)",This is Ozzy. He woke up 2 minutes before he had to be ready for the Christmas party. 9/10 classic Ozzy https://t.co/Kt9vmw0Fap,,,,https://twitter.com/dog_rates/status/680115823365742593/photo/1,9.0,10,Ozzy,NA,en,2909,1009,Pug,0.999365
