tweet_id,in_reply_to_status_id,in_reply_to_user_id,timestamp,text,retweeted_status_id,retweeted_status_user_id,retweeted_status_timestamp,expanded_urls,rating_numerator,rating_denominator,name,stages,Language,Like_Count,Retweet_count,Most_Likely_Prediction-p1,p1_conf
759557299618865152,,,"DatetimeIndex(['2016-07-31 01:12:26'], dtype='datetime64[ns]', freq=None)",This is Emma. She can't believe her last guess didn't hit. Convinced ur stacking them on top of each other. 10/10 https://t.co/JRV1dhBYwu,,,,"https://twitter.com/dog_rates/status/759557299618865152/photo/1,https://twitter.com/dog_rates/status/759557299618865152/photo/1,https://twitter.com/dog_rates/status/759557299618865152/photo/1",10.0,10,Emma,NA,en,5116,1315,Golden_retriever,0.763333
759447681597108224,,,"DatetimeIndex(['2016-07-30 17:56:51'], dtype='datetime64[ns]', freq=None)",This is Oakley. He has no idea what happened here. Even offered to help clean it up. 11/10 such a heckin good boy https://t.co/vT3JM8b989,,,,https://twitter.com/dog_rates/status/759447681597108224/photo/1,11.0,10,Oakley,NA,en,9268,2750,Kuvasz,0.223148
759197388317847553,,,"DatetimeIndex(['2016-07-30 01:22:17'], dtype='datetime64[ns]', freq=None)",This is Luna. She's just heckin precious af I have nothing else to say. 12/10 https://t.co/gQH2mmKIJW,,,,"https://twitter.com/dog_rates/status/759197388317847553/photo/1,https://twitter.com/dog_rates/status/759197388317847553/photo/1,https://twitter.com/dog_rates/status/759197388317847553/photo/1",12.0,10,Luna,NA,en,6605,2173,Kuvasz,0.5113409999999999
759099523532779520,,,"DatetimeIndex(['2016-07-29 18:53:24'], dtype='datetime64[ns]', freq=None)",Meet Toby. He has a drinking problem. Inflatable marijuana plant in the back is also not a good look. 7/10 cmon Toby https://t.co/Cim4DSj6Oi,,,,https://twitter.com/dog_rates/status/759099523532779520/photo/1,7.0,10,Toby,NA,en,15811,4704,Shetland_sheepdog,0.12903399999999998
759047813560868866,,,"DatetimeIndex(['2016-07-29 15:27:55'], dtype='datetime64[ns]', freq=None)",This is Spencer. He's part of the Queen's Guard. Takes his job very seriously. 11/10 https://t.co/8W5iSOgXfx,,,,"https://twitter.com/dog_rates/status/759047813560868866/photo/1,https://twitter.com/dog_rates/status/759047813560868866/photo/1",11.0,10,Spencer,NA,en,7097,2256,Labrador_retriever,0.778546
758854675097526272,,,"DatetimeIndex(['2016-07-29 02:40:28'], dtype='datetime64[ns]', freq=None)","This is Lilli Bee &amp; Honey Bear. Unfortunately, they were both born with no eyes. So heckin sad. Both 11/10 https://t.co/4UrfOZhztW",,,,"https://twitter.com/dog_rates/status/758854675097526272/photo/1,https://twitter.com/dog_rates/status/758854675097526272/photo/1,https://twitter.com/dog_rates/status/758854675097526272/photo/1,https://twitter.com/dog_rates/status/758854675097526272/photo/1",11.0,10,Lilli,NA,en,3855,1000,Barrow,0.974047
758740312047005698,,,"DatetimeIndex(['2016-07-28 19:06:01'], dtype='datetime64[ns]', freq=None)",Meet Boston. He's worried because his tongue won't fit all the way in his mouth. 12/10 it'll be ok deep breaths pup https://t.co/rfWQ4T9iQj,,,,https://twitter.com/dog_rates/status/758740312047005698/photo/1,12.0,10,Boston,NA,en,6238,1786,Chesapeake_bay_retriever,0.848514
758474966123810816,,,"DatetimeIndex(['2016-07-28 01:31:38'], dtype='datetime64[ns]', freq=None)",This is Brandonald. He accidentally opened the front facing camera. Playing it off rather heckin well. 11/10 https://t.co/uPUAotqQtM,,,,https://twitter.com/dog_rates/status/758474966123810816/photo/1,11.0,10,Brandonald,NA,en,4152,1109,Pembroke,0.546145
758405701903519748,,,"DatetimeIndex(['2016-07-27 20:56:24'], dtype='datetime64[ns]', freq=None)",This is Odie. He falls asleep wherever he wants. Must be nice. 10/10 https://t.co/M9BXCSDVjh,,,,"https://twitter.com/dog_rates/status/758405701903519748/photo/1,https://twitter.com/dog_rates/status/758405701903519748/photo/1,https://twitter.com/dog_rates/status/758405701903519748/photo/1,https://twitter.com/dog_rates/status/758405701903519748/photo/1",10.0,10,Odie,NA,en,5665,2150,Chesapeake_bay_retriever,0.702954
758355060040593408,,,"DatetimeIndex(['2016-07-27 17:35:10'], dtype='datetime64[ns]', freq=None)",This is Corey. He's a Portobello Corgicool. Trying to convince you that he's not a hipster. 11/10 yea right Corey https://t.co/NzWUrFZydr,,,,https://twitter.com/dog_rates/status/758355060040593408/photo/1,11.0,10,Corey,NA,en,3728,1212,Pembroke,0.987643
757741869644341248,,,"DatetimeIndex(['2016-07-26 00:58:34'], dtype='datetime64[ns]', freq=None)",This is Leonard. He hides in bushes to escape his problems. 10/10 relatable af https://t.co/TdyGTcX0uo,,,,"https://twitter.com/dog_rates/status/757741869644341248/photo/1,https://twitter.com/dog_rates/status/757741869644341248/photo/1",10.0,10,Leonard,NA,en,7492,3627,Skunk,0.609715
757725642876129280,,,"DatetimeIndex(['2016-07-25 23:54:05'], dtype='datetime64[ns]', freq=None)",This is Beckham. He fell asleep at the wheel. Very churlish. Looks to have a backpup driver tho. That's good. 11/10 https://t.co/rptsOm73Wr,,,,"https://twitter.com/dog_rates/status/757725642876129280/photo/1,https://twitter.com/dog_rates/status/757725642876129280/photo/1",11.0,10,Beckham,NA,en,4945,1366,Seat_belt,0.425176
757611664640446465,,,"DatetimeIndex(['2016-07-25 16:21:11'], dtype='datetime64[ns]', freq=None)",This is Cooper. He tries to come across as feisty but it never works for very long. 12/10 https://t.co/AVks8DjHwB,,,,"https://twitter.com/dog_rates/status/757611664640446465/photo/1,https://twitter.com/dog_rates/status/757611664640446465/photo/1,https://twitter.com/dog_rates/status/757611664640446465/photo/1",12.0,10,Cooper,NA,en,4950,1246,Bluetick,0.829259
757354760399941633,,,"DatetimeIndex(['2016-07-24 23:20:20'], dtype='datetime64[ns]', freq=None)","This is Devn (pronounced ""Eric""). He forgot how to eat the apple halfway through. Wtf Devn get it together. 8/10 https://t.co/7waRPODGyO",,,,"https://twitter.com/dog_rates/status/757354760399941633/photo/1,https://twitter.com/dog_rates/status/757354760399941633/photo/1",8.0,10,Devn,NA,en,4919,1589,Italian_greyhound,0.914667
756998049151549440,,,"DatetimeIndex(['2016-07-23 23:42:53'], dtype='datetime64[ns]', freq=None)",This is Oliver. He's an English Creamschnitzel. The rarest of schnitzels. 11/10 would pet quite firmly https://t.co/qbO5X6dYuj,,,,"https://twitter.com/dog_rates/status/756998049151549440/photo/1,https://twitter.com/dog_rates/status/756998049151549440/photo/1,https://twitter.com/dog_rates/status/756998049151549440/photo/1,https://twitter.com/dog_rates/status/756998049151549440/photo/1",11.0,10,Oliver,NA,en,6824,2224,Golden_retriever,0.678555
756651752796094464,,,"DatetimeIndex(['2016-07-23 00:46:50'], dtype='datetime64[ns]', freq=None)",This is Gert. He just wants you to be happy. 11/10 would pat on the head so damn well https://t.co/l0Iwj6rLFW,,,,https://twitter.com/dog_rates/status/756651752796094464/photo/1,11.0,10,Gert,NA,en,5525,1480,Pembroke,0.294808
755110668769038337,,,"DatetimeIndex(['2016-07-18 18:43:07'], dtype='datetime64[ns]', freq=None)",This is Watson. He trust falls on command. 13/10 it's elementary... (IG: wat.ki) https://t.co/goX3jewkYN,,,,https://twitter.com/dog_rates/status/755110668769038337/video/1,13.0,10,Watson,NA,en,23054,12368,Labrador_retriever,0.708974
754856583969079297,,,"DatetimeIndex(['2016-07-18 01:53:28'], dtype='datetime64[ns]', freq=None)",This is Winnie. She's not a fan of the fast moving air. 11/10 objects in mirror may be more fluffy than they appear https://t.co/FyHrk20gUR,,,,"https://twitter.com/dog_rates/status/754856583969079297/photo/1,https://twitter.com/dog_rates/status/754856583969079297/photo/1,https://twitter.com/dog_rates/status/754856583969079297/photo/1",11.0,10,Winnie,NA,en,7475,2812,Golden_retriever,0.8723850000000001
754747087846248448,,,"DatetimeIndex(['2016-07-17 18:38:22'], dtype='datetime64[ns]', freq=None)",This is Keith. He's pursuing a more 2D lifestyle. Idiosyncratic af. 12/10 follow your dreams Keith https://t.co/G9ufksBMlU,,,,https://twitter.com/dog_rates/status/754747087846248448/photo/1,12.0,10,Keith,NA,en,2802,583,Rotisserie,0.4714930000000001
754482103782404096,,,"DatetimeIndex(['2016-07-17 01:05:25'], dtype='datetime64[ns]', freq=None)",This is Milo. He's currently plotting his revenge. 10/10 https://t.co/ca0q9HM8II,,,,https://twitter.com/dog_rates/status/754482103782404096/video/1,10.0,10,Milo,NA,en,5770,2171,Tub,0.596796
754449512966619136,,,"DatetimeIndex(['2016-07-16 22:55:55'], dtype='datetime64[ns]', freq=None)",This is Dex. He can see into your past and future. Mesmerizing af 11/10 https://t.co/0dYI0Cpdge,,,,https://twitter.com/dog_rates/status/754449512966619136/photo/1,11.0,10,Dex,NA,en,4083,822,Beagle,0.858513
754011816964026368,,,"DatetimeIndex(['2016-07-15 17:56:40'], dtype='datetime64[ns]', freq=None)",This is Charlie. He pouts until he gets to go on the swing. 12/10 manipulative af https://t.co/ilwQqWFKCh,,,,"https://twitter.com/dog_rates/status/754011816964026368/photo/1,https://twitter.com/dog_rates/status/754011816964026368/photo/1",12.0,10,Charlie,NA,en,9563,4017,French_bulldog,0.600985
753398408988139520,,,"DatetimeIndex(['2016-07-14 01:19:12'], dtype='datetime64[ns]', freq=None)",This is Scout. Her batteries are low. 12/10 precious af https://t.co/ov05LIoQJX,,,,https://twitter.com/dog_rates/status/753398408988139520/video/1,12.0,10,Scout,NA,en,6288,2140,Whippet,0.163794
753375668877008896,,,"DatetimeIndex(['2016-07-13 23:48:51'], dtype='datetime64[ns]', freq=None)",This is Hank. He's mischievous af. Doesn't even know what he was trying to do here. 8/10 quit the shit Hank damn https://t.co/3r7wjfsXHc,,,,https://twitter.com/dog_rates/status/753375668877008896/photo/1,8.0,10,Hank,NA,en,8279,2604,Bluetick,0.36007100000000003
753294487569522689,,,"DatetimeIndex(['2016-07-13 18:26:16'], dtype='datetime64[ns]', freq=None)",This is Ace. He's a window washer. One of the best around. 11/10 helpful af https://t.co/sTuRoYfzPv,,,,https://twitter.com/dog_rates/status/753294487569522689/photo/1,11.0,10,Ace,NA,en,3703,1162,Chow,0.194773
753026973505581056,,,"DatetimeIndex(['2016-07-13 00:43:15'], dtype='datetime64[ns]', freq=None)",Say hello to Tayzie. She's a Barbadian Bugaboop. Seems quite social. A rare quality for a Bugaboop. 10/10 petable af https://t.co/6qF5YZx6OV,,,,"https://twitter.com/dog_rates/status/753026973505581056/photo/1,https://twitter.com/dog_rates/status/753026973505581056/photo/1,https://twitter.com/dog_rates/status/753026973505581056/photo/1,https://twitter.com/dog_rates/status/753026973505581056/photo/1",10.0,10,Tayzie,NA,en,4224,1087,Pembroke,0.868511
752917284578922496,,,"DatetimeIndex(['2016-07-12 17:27:23'], dtype='datetime64[ns]', freq=None)",This is Grizzie. She's a semi-submerged Bahraini Buttersplotch. Appears alert af. Snazzy tongue. 11/10 would def pet https://t.co/WZ4zzkXXnW,,,,https://twitter.com/dog_rates/status/752917284578922496/photo/1,11.0,10,Grizzie,NA,en,7461,1749,German_shepherd,0.609283
752173152931807232,,,"DatetimeIndex(['2016-07-10 16:10:29'], dtype='datetime64[ns]', freq=None)",This is Brody. He's a lifeguard. Always prepared for rescue. 12/10 would fake drown just to get saved by him https://t.co/olDmwNjOy1,,,,"https://twitter.com/dog_rates/status/752173152931807232/photo/1,https://twitter.com/dog_rates/status/752173152931807232/photo/1",12.0,10,Brody,NA,en,6466,2061,Labrador_retriever,0.527659
751937170840121344,,,"DatetimeIndex(['2016-07-10 00:32:46'], dtype='datetime64[ns]', freq=None)",This is Ruby. Her ice cube is melting. She doesn't know what to do about it. 11/10 https://t.co/Vfc3eAFl2q,,,,https://twitter.com/dog_rates/status/751937170840121344/photo/1,11.0,10,Ruby,NA,en,5681,1497,Lakeland_terrier,0.4241680000000001
751830394383790080,,,"DatetimeIndex(['2016-07-09 17:28:29'], dtype='datetime64[ns]', freq=None)",This is Tucker. He's very camera shy. 12/10 would give stellar belly rubs to https://t.co/BJRsxuLF1w,,,,"https://twitter.com/dog_rates/status/751830394383790080/photo/1,https://twitter.com/dog_rates/status/751830394383790080/photo/1,https://twitter.com/dog_rates/status/751830394383790080/photo/1",12.0,10,Tucker,NA,en,6312,2175,Chow,0.703569
751598357617971201,,,"DatetimeIndex(['2016-07-09 02:06:27'], dtype='datetime64[ns]', freq=None)",This is Toby. A cat got his tongue. 13/10 adorable af https://t.co/fHQrBKYSLC,,,,"https://twitter.com/dog_rates/status/751598357617971201/photo/1,https://twitter.com/dog_rates/status/751598357617971201/photo/1,https://twitter.com/dog_rates/status/751598357617971201/photo/1,https://twitter.com/dog_rates/status/751598357617971201/photo/1",13.0,10,Toby,NA,en,8570,3371,Toy_poodle,0.757756
751538714308972544,,,"DatetimeIndex(['2016-07-08 22:09:27'], dtype='datetime64[ns]', freq=None)",This is Max. She has one ear that's always slightly more alert than the other. 10/10 wonky af https://t.co/5eJg69G8vY,,,,"https://twitter.com/dog_rates/status/751538714308972544/photo/1,https://twitter.com/dog_rates/status/751538714308972544/photo/1,https://twitter.com/dog_rates/status/751538714308972544/photo/1",10.0,10,Max,NA,en,5464,1410,Labrador_retriever,0.516257
751251247299190784,,,"DatetimeIndex(['2016-07-08 03:07:09'], dtype='datetime64[ns]', freq=None)",This is Gilbert. He's being chased by a battalion of miniature floof cows. 10/10 we all believe in you Gilbert https://t.co/wayKZkDRTG,,,,https://twitter.com/dog_rates/status/751251247299190784/video/1,10.0,10,Gilbert,NA,en,13571,6549,Walker_hound,0.178852
750719632563142656,,,"DatetimeIndex(['2016-07-06 15:54:42'], dtype='datetime64[ns]', freq=None)",This is Meyer. He has to hold somebody's hand during car rides. He's also wearing a seatbelt. 12/10 responsible af https://t.co/WS6BoApYyL,,,,https://twitter.com/dog_rates/status/750719632563142656/photo/1,12.0,10,Meyer,NA,en,14364,5617,Pembroke,0.972587
750429297815552001,,,"DatetimeIndex(['2016-07-05 20:41:01'], dtype='datetime64[ns]', freq=None)",This is Arnie. He's a Nova Scotian Fridge Floof. Rare af. 12/10 https://t.co/lprdOylVpS,,,,"https://twitter.com/dog_rates/status/750429297815552001/photo/1,https://twitter.com/dog_rates/status/750429297815552001/photo/1",12.0,10,Arnie,NA,en,14316,4818,Golden_retriever,0.964929
750132105863102464,,,"DatetimeIndex(['2016-07-05 01:00:05'], dtype='datetime64[ns]', freq=None)",This is Stewie. He will roundhouse kick anyone who questions his independence. 11/10 free af https://t.co/dDx2gKefYo,,,,https://twitter.com/dog_rates/status/750132105863102464/photo/1,11.0,10,Stewie,NA,en,3935,1405,Toy_poodle,0.4780180000000001
750117059602808832,,,"DatetimeIndex(['2016-07-05 00:00:18'], dtype='datetime64[ns]', freq=None)",This is Calvin. He just loves America so much. 10/10 would roll around in flag with https://t.co/RXdzWaCQHm,,,,"https://twitter.com/dog_rates/status/750117059602808832/photo/1,https://twitter.com/dog_rates/status/750117059602808832/photo/1,https://twitter.com/dog_rates/status/750117059602808832/photo/1,https://twitter.com/dog_rates/status/750117059602808832/photo/1",10.0,10,Calvin,NA,en,4678,1441,Shih-tzu,0.814405
750101899009982464,,,"DatetimeIndex(['2016-07-04 23:00:03'], dtype='datetime64[ns]', freq=None)",Meet Lilah. She agreed on one quick pic. Now she'd like to go mentally prepare for the onslaught of fireworks. 11/10 https://t.co/enCpXzZHkD,,,,"https://twitter.com/dog_rates/status/750101899009982464/photo/1,https://twitter.com/dog_rates/status/750101899009982464/photo/1",11.0,10,Lilah,NA,en,3299,935,Golden_retriever,0.316704
750086836815486976,,,"DatetimeIndex(['2016-07-04 22:00:12'], dtype='datetime64[ns]', freq=None)",This is Spanky. He was a member of the 2002 USA Winter Olympic speed skating team. Accomplished af. 12/10 https://t.co/7tlZPrePXd,,,,https://twitter.com/dog_rates/status/750086836815486976/photo/1,12.0,10,Spanky,NA,en,2351,607,Pug,0.978277
750056684286914561,,,"DatetimeIndex(['2016-07-04 20:00:23'], dtype='datetime64[ns]', freq=None)",This is Jameson. He had a few too many in the name of freedom. I can't not respect that. 11/10 'Merica https://t.co/8zQvXM6pG5,,,,https://twitter.com/dog_rates/status/750056684286914561/photo/1,11.0,10,Jameson,NA,en,3391,991,Saluki,0.484428
750041628174217216,,,"DatetimeIndex(['2016-07-04 19:00:33'], dtype='datetime64[ns]', freq=None)",This is Beau. He's trying to keep his daddy from packing to leave for Annual Training. 13/10 and now I'm crying https://t.co/7JeDfQvzzI,,,,https://twitter.com/dog_rates/status/750041628174217216/photo/1,13.0,10,Beau,NA,en,3448,689,Labrador_retriever,0.252031
750026558547456000,,,"DatetimeIndex(['2016-07-04 18:00:41'], dtype='datetime64[ns]', freq=None)",Meet Jax &amp; Jil. Jil is yelling the pledge of allegiance. If u cant take the freedom get out the kitchen Jax. 10/10s https://t.co/jrg29NDNhI,,,,https://twitter.com/dog_rates/status/750026558547456000/photo/1,10.0,10,Jax,NA,en,2943,875,Standard_poodle,0.258732
749996283729883136,,,"DatetimeIndex(['2016-07-04 16:00:22'], dtype='datetime64[ns]', freq=None)",This is Bo. He emanates happiness. 12/10 I could cut the freedom with a knife https://t.co/c7LNFt39eR,,,,https://twitter.com/dog_rates/status/749996283729883136/photo/1,12.0,10,Bo,NA,en,3278,896,Old_english_sheepdog,0.515319
749981277374128128,,,"DatetimeIndex(['2016-07-04 15:00:45'], dtype='datetime64[ns]', freq=None)",This is Atticus. He's quite simply America af. 1776/10 https://t.co/GRXwMxLBkh,,,,https://twitter.com/dog_rates/status/749981277374128128/photo/1,1776.0,10,Atticus,NA,en,5536,2724,Bow_tie,0.533941
749774190421639168,,,"DatetimeIndex(['2016-07-04 01:17:51'], dtype='datetime64[ns]', freq=None)",This is Lucy. She's a Benebop Cumberplop. 12/10 would hold against my face https://t.co/4yXa801fgl,,,,https://twitter.com/dog_rates/status/749774190421639168/photo/1,12.0,10,Lucy,NA,en,5039,1463,Pekinese,0.8790120000000001
749395845976588288,,,"DatetimeIndex(['2016-07-03 00:14:27'], dtype='datetime64[ns]', freq=None)",This is George. He just remembered that bees are dying globally at an alarming rate. Scary stuff George. 10/10 https://t.co/lznl6QGkYc,,,,"https://twitter.com/dog_rates/status/749395845976588288/photo/1,https://twitter.com/dog_rates/status/749395845976588288/photo/1",10.0,10,George,NA,en,9331,3857,Pomeranian,0.973715
749064354620928000,,,"DatetimeIndex(['2016-07-02 02:17:13'], dtype='datetime64[ns]', freq=None)",Meet Winston. He's pupset because I forgot to mention that it's Canada Day today. 11/10 please forgive me Winston https://t.co/xEY8dbJxnF,,,,"https://twitter.com/dog_rates/status/749064354620928000/photo/1,https://twitter.com/dog_rates/status/749064354620928000/photo/1",11.0,10,Winston,NA,en,5194,1682,Pug,0.985222
749036806121881602,,,"DatetimeIndex(['2016-07-02 00:27:45'], dtype='datetime64[ns]', freq=None)",This is Dietrich. He hops at random. Other doggos don't understand him. It upsets him greatly. 8/10 would comfort https://t.co/U8cSRz8wzC,,,,https://twitter.com/dog_rates/status/749036806121881602/photo/1,8.0,10,Dietrich,NA,en,3359,874,Sulphur-crested_cockatoo,0.960276
748977405889503236,,,"DatetimeIndex(['2016-07-01 20:31:43'], dtype='datetime64[ns]', freq=None)",What jokester sent in a pic without a dog in it? This is not @rock_rates. This is @dog_rates. Thank you ...10/10 https://t.co/nDPaYHrtNX,,,,https://twitter.com/dog_rates/status/748977405889503236/photo/1,10.0,10,not,NA,en,11645,3802,German_short-haired_pointer,0.742216
748699167502000129,,,"DatetimeIndex(['2016-07-01 02:06:06'], dtype='datetime64[ns]', freq=None)",Meet Tripp. He's being eaten by a sherk and doesn't even care. Unfazed af. 11/10 keep doin you Tripp https://t.co/gGxjthmG1c,,,,"https://twitter.com/dog_rates/status/748699167502000129/photo/1,https://twitter.com/dog_rates/status/748699167502000129/photo/1",11.0,10,Tripp,NA,en,5130,1778,Pembroke,0.849029
748575535303884801,,,"DatetimeIndex(['2016-06-30 17:54:50'], dtype='datetime64[ns]', freq=None)",This is one of the most reckless puppers I've ever seen. How she got a license in the first place is beyond me. 6/10 https://t.co/z5bAdtn9kd,,,,https://twitter.com/dog_rates/status/748575535303884801/photo/1,6.0,10,one,NA,en,6577,2216,Muzzle,0.176172
748568946752774144,,,"DatetimeIndex(['2016-06-30 17:28:39'], dtype='datetime64[ns]', freq=None)",This is Cora. She rings a bell for treats. 12/10 precious af (vid by @skyehellenkamp) https://t.co/uUncaAGH18,,,,https://twitter.com/dog_rates/status/748568946752774144/video/1,12.0,10,Cora,NA,en,2371,751,Tibetan_terrier,0.32816100000000004
748324050481647620,,,"DatetimeIndex(['2016-06-30 01:15:31'], dtype='datetime64[ns]', freq=None)",This is Duke. He permanently looks like he just tripped over something. 11/10 https://t.co/1sNtG7GgiO,,,,"https://twitter.com/dog_rates/status/748324050481647620/photo/1,https://twitter.com/dog_rates/status/748324050481647620/photo/1",11.0,10,Duke,NA,en,4012,850,Shetland_sheepdog,0.880499
747844099428986880,,,"DatetimeIndex(['2016-06-28 17:28:22'], dtype='datetime64[ns]', freq=None)",This is Huxley. He's pumped for #BarkWeek. Even has a hat. Ears are quite magical. 11/10 would remove hat to pat https://t.co/V7h5NMYbYz,,,,https://twitter.com/dog_rates/status/747844099428986880/photo/1,11.0,10,Huxley,NA,en,3035,831,Pembroke,0.360428
747600769478692864,,,"DatetimeIndex(['2016-06-28 01:21:27'], dtype='datetime64[ns]', freq=None)",This is Bookstore and Seaweed. Bookstore is tired and Seaweed is an asshole. 10/10 and 7/10 respectively https://t.co/eUGjGjjFVJ,,,,"https://twitter.com/dog_rates/status/747600769478692864/photo/1,https://twitter.com/dog_rates/status/747600769478692864/photo/1",10.0,10,Bookstore,NA,en,2513,606,Chesapeake_bay_retriever,0.804363
747219827526344708,,,"DatetimeIndex(['2016-06-27 00:07:44'], dtype='datetime64[ns]', freq=None)",This is Atticus. He's remaining calm but his costume looks terrified. 11/10 https://t.co/uT7QeZI34U,,,,"https://twitter.com/dog_rates/status/747219827526344708/photo/1,https://twitter.com/dog_rates/status/747219827526344708/photo/1",11.0,10,Atticus,NA,en,5701,1746,Shetland_sheepdog,0.548018
747204161125646336,,,"DatetimeIndex(['2016-06-26 23:05:29'], dtype='datetime64[ns]', freq=None)",This is Clark. He's deadly af. Clearly part shark (see pic 2). 10/10 would totally still try to pet https://t.co/dmdEBOEctC,,,,"https://twitter.com/dog_rates/status/747204161125646336/photo/1,https://twitter.com/dog_rates/status/747204161125646336/photo/1",10.0,10,Clark,NA,en,3666,1017,Coil,0.5336989999999999
746726898085036033,,,"DatetimeIndex(['2016-06-25 15:29:00'], dtype='datetime64[ns]', freq=None)",Meet Abby. She's incredibly distracting. Just wants to help steer. Hazardous af. Still 12/10 would pet while driving https://t.co/gLbLiZtwsp,,,,https://twitter.com/dog_rates/status/746726898085036033/photo/1,12.0,10,Abby,NA,en,6533,1990,Golden_retriever,0.25650500000000004
746507379341139972,,,"DatetimeIndex(['2016-06-25 00:56:43'], dtype='datetime64[ns]', freq=None)",This is Shiloh. She did not pass the soft mouth egg test. 10/10 would absolutely still pet https://t.co/PlR6hjqvr5,,,,"https://twitter.com/dog_rates/status/746507379341139972/photo/1,https://twitter.com/dog_rates/status/746507379341139972/photo/1",10.0,10,Shiloh,NA,en,5018,1200,Toy_poodle,0.508292
746131877086527488,,,"DatetimeIndex(['2016-06-24 00:04:36'], dtype='datetime64[ns]', freq=None)",This is Gustav. He has claimed that plant. It is his now. 10/10 would not try to take his plant away https://t.co/uRI7HBgGJX,,,,https://twitter.com/dog_rates/status/746131877086527488/photo/1,10.0,10,Gustav,NA,en,7441,2447,Chow,0.575637
746056683365994496,,,"DatetimeIndex(['2016-06-23 19:05:49'], dtype='datetime64[ns]', freq=None)",This is Arlen and Thumpelina. They are best pals. Cuddly af. 11/10 for both puppers https://t.co/VJgbgIzIHx,,,,"https://twitter.com/dog_rates/status/746056683365994496/photo/1,https://twitter.com/dog_rates/status/746056683365994496/photo/1",11.0,10,Arlen,NA,en,3834,911,Shetland_sheepdog,0.43332
745789745784041472,,,"DatetimeIndex(['2016-06-23 01:25:06'], dtype='datetime64[ns]', freq=None)",This is Gus. He didn't win the Powerball. Quite perturbed about it. Still 10/10 would comfort in time of need https://t.co/3wc246LOtu,,,,https://twitter.com/dog_rates/status/745789745784041472/photo/1,10.0,10,Gus,NA,en,4362,1181,Pekinese,0.984267
745712589599014916,,,"DatetimeIndex(['2016-06-22 20:18:30'], dtype='datetime64[ns]', freq=None)",This is Percy. He fell asleep at the wheel. Irresponsible af. 7/10 absolute menace on the roadway https://t.co/QHbvtvaw8E,,,,https://twitter.com/dog_rates/status/745712589599014916/photo/1,7.0,10,Percy,NA,en,7524,2580,Seat_belt,0.379055
745314880350101504,,,"DatetimeIndex(['2016-06-21 17:58:09'], dtype='datetime64[ns]', freq=None)",This is Sugar. She excels underwater. 12/10 photogenic af https://t.co/AWMeXJJz64,,,,"https://twitter.com/dog_rates/status/745314880350101504/photo/1,https://twitter.com/dog_rates/status/745314880350101504/photo/1,https://twitter.com/dog_rates/status/745314880350101504/photo/1,https://twitter.com/dog_rates/status/745314880350101504/photo/1",12.0,10,Sugar,NA,en,7727,3065,Ice_bear,0.807762
745057283344719872,,,"DatetimeIndex(['2016-06-21 00:54:33'], dtype='datetime64[ns]', freq=None)",This is Oliver. He's downright gorgeous as hell. Should be on the cover of Dogue. 12/10 would introduce to mom https://t.co/BkgU3rrsXA,,,,"https://twitter.com/dog_rates/status/745057283344719872/photo/1,https://twitter.com/dog_rates/status/745057283344719872/photo/1",12.0,10,Oliver,NA,en,7816,2533,Shetland_sheepdog,0.963985
